{
  "$schema": "https://rokha.ai/schemas/rig-template-v1.json",
  "name": "Full workflow",
  "intent": "The Explore and Audit patterns chained into one flow: pick a registry listing, dissect its use cases, vet its safety, and land on a verdict.",
  "intent_category": "build",
  "input": {
    "label": "the skill or tool to evaluate",
    "kind": "skill",
    "hint": "pick the registry listing you want a decision on"
  },
  "steps": [
    {
      "role": "primary",
      "tag": "lookup",
      "query": "search registry discovery tools",
      "pin": {
        "name": "Rokha Registry Search",
        "source": "rokha",
        "slug": "rokha-registry",
        "description": "Search the Rokha Registry of published agent skills, harnesses, and rigs — Rokha runs it over her own MCP registry tools."
      },
      "expects": "the skill/tool the user wants to evaluate (its name)",
      "instruction": "Search the Rokha Registry for the skill/tool the user named as the input. Pull up everything about it: what it does, how it runs, who made it.",
      "produces": "the chosen listing + what it does and how it runs"
    },
    {
      "role": "step",
      "tag": "use-cases",
      "query": "analyze documentation summarize",
      "expects": "the chosen listing + what it does",
      "instruction": "Using the previous step's listing, dissect its use cases: three concrete workflows it enables, what registry skills pair well with it, and who it's for.",
      "produces": "three use cases + best pairings + who it's for"
    },
    {
      "role": "step",
      "tag": "vet",
      "query": "security audit code review",
      "expects": "the chosen listing",
      "instruction": "Give the same listing the safety read: what it accesses (tools, endpoints, credentials), trust boundaries, what could go wrong, and any red flags.",
      "produces": "a safety read + risk verdict"
    },
    {
      "role": "step",
      "tag": "verdict",
      "query": "write report markdown",
      "expects": "the use cases + the safety read",
      "instruction": "Combine the exploration and the safety read into one decision brief, ending in a clear adopt / try-with-care / avoid verdict.",
      "produces": "a decision brief with an adopt/try-with-care/avoid verdict"
    }
  ]
}
