{
  "$schema": "https://rokha.ai/schemas/rig-template-v1.json",
  "name": "Audit",
  "intent": "fetch a target and audit it for security and trust-boundary issues",
  "intent_category": "audit",
  "steps": [
    {
      "role": "fetch",
      "tag": "fetch",
      "query": "fetch url http request",
      "instruction": "Fetch the target the user provides \u2014 a registry listing (skill, harness, or rig), a URL, a repo, or an endpoint \u2014 and gather its source material."
    },
    {
      "role": "analyze",
      "tag": "analyze",
      "query": "security audit code review",
      "instruction": "Inspect it for security issues: what it accesses (tools, endpoints, credentials), trust boundaries, and risky patterns; flag anything suspicious."
    },
    {
      "role": "report",
      "tag": "report",
      "query": "write report markdown",
      "instruction": "Write the findings up as a concise audit brief: scope, findings by severity, and a clear trust verdict."
    }
  ]
}
